[INFO] Scanning for projects...
[INFO] 
[INFO] ----------< com.sitemaderiegoagoteo:sistema-riego-goteo-api >-----------
[INFO] Building sistema-riego-goteo-api 0.0.1-SNAPSHOT
[INFO]   from pom.xml
[INFO] --------------------------------[ jar ]---------------------------------
[INFO] 
[INFO] --- resources:3.3.1:resources (default-resources) @ sistema-riego-goteo-api ---
[INFO] Copying 1 resource from src\main\resources to target\classes
[INFO] Copying 1 resource from src\main\resources to target\classes
[INFO] 
[INFO] --- compiler:3.13.0:compile (default-compile) @ sistema-riego-goteo-api ---
[INFO] Recompiling the module because of changed source code.
[INFO] Compiling 179 source files with javac [debug parameters release 17] to target\classes
[INFO] /C:/Users/elian/OneDrive/Documentos/1-Proyectos/Reales/sistema-riego-goteo-api/src/main/java/com/sistemariegoagoteo/sistema_riego_goteo_api/service/geocoding/GeocodingService.java: Some input files use or override a deprecated API.
[INFO] /C:/Users/elian/OneDrive/Documentos/1-Proyectos/Reales/sistema-riego-goteo-api/src/main/java/com/sistemariegoagoteo/sistema_riego_goteo_api/service/geocoding/GeocodingService.java: Recompile with -Xlint:deprecation for details.
[INFO] 
[INFO] --- resources:3.3.1:testResources (default-testResources) @ sistema-riego-goteo-api ---
[INFO] Copying 1 resource from src\test\resources to target\test-classes
[INFO] 
[INFO] --- compiler:3.13.0:testCompile (default-testCompile) @ sistema-riego-goteo-api ---
[INFO] Recompiling the module because of changed dependency.
[INFO] Compiling 9 source files with javac [debug parameters release 17] to target\test-classes
[WARNING] /C:/Users/elian/OneDrive/Documentos/1-Proyectos/Reales/sistema-riego-goteo-api/src/test/java/com/sistemariegoagoteo/sistema_riego_goteo_api/controller/auth/AuthControllerTest.java:[46,10] org.springframework.boot.test.mock.mockito.MockBean in org.springframework.boot.test.mock.mockito has been deprecated and marked for removal
[WARNING] /C:/Users/elian/OneDrive/Documentos/1-Proyectos/Reales/sistema-riego-goteo-api/src/test/java/com/sistemariegoagoteo/sistema_riego_goteo_api/controller/auth/AuthControllerTest.java:[46,10] org.springframework.boot.test.mock.mockito.MockBean in org.springframework.boot.test.mock.mockito has been deprecated and marked for removal
[WARNING] /C:/Users/elian/OneDrive/Documentos/1-Proyectos/Reales/sistema-riego-goteo-api/src/test/java/com/sistemariegoagoteo/sistema_riego_goteo_api/controller/auth/AuthControllerTest.java:[46,10] org.springframework.boot.test.mock.mockito.MockBean in org.springframework.boot.test.mock.mockito has been deprecated and marked for removal
[WARNING] /C:/Users/elian/OneDrive/Documentos/1-Proyectos/Reales/sistema-riego-goteo-api/src/test/java/com/sistemariegoagoteo/sistema_riego_goteo_api/controller/auth/AuthControllerTest.java:[46,10] org.springframework.boot.test.mock.mockito.MockBean in org.springframework.boot.test.mock.mockito has been deprecated and marked for removal
[WARNING] /C:/Users/elian/OneDrive/Documentos/1-Proyectos/Reales/sistema-riego-goteo-api/src/test/java/com/sistemariegoagoteo/sistema_riego_goteo_api/controller/auth/AuthControllerTest.java:[46,10] org.springframework.boot.test.mock.mockito.MockBean in org.springframework.boot.test.mock.mockito has been deprecated and marked for removal
[WARNING] /C:/Users/elian/OneDrive/Documentos/1-Proyectos/Reales/sistema-riego-goteo-api/src/test/java/com/sistemariegoagoteo/sistema_riego_goteo_api/controller/auth/AuthControllerTest.java:[49,10] org.springframework.boot.test.mock.mockito.MockBean in org.springframework.boot.test.mock.mockito has been deprecated and marked for removal
[WARNING] /C:/Users/elian/OneDrive/Documentos/1-Proyectos/Reales/sistema-riego-goteo-api/src/test/java/com/sistemariegoagoteo/sistema_riego_goteo_api/controller/auth/AuthControllerTest.java:[49,10] org.springframework.boot.test.mock.mockito.MockBean in org.springframework.boot.test.mock.mockito has been deprecated and marked for removal
[WARNING] /C:/Users/elian/OneDrive/Documentos/1-Proyectos/Reales/sistema-riego-goteo-api/src/test/java/com/sistemariegoagoteo/sistema_riego_goteo_api/controller/auth/AuthControllerTest.java:[49,10] org.springframework.boot.test.mock.mockito.MockBean in org.springframework.boot.test.mock.mockito has been deprecated and marked for removal
[WARNING] /C:/Users/elian/OneDrive/Documentos/1-Proyectos/Reales/sistema-riego-goteo-api/src/test/java/com/sistemariegoagoteo/sistema_riego_goteo_api/controller/auth/AuthControllerTest.java:[49,10] org.springframework.boot.test.mock.mockito.MockBean in org.springframework.boot.test.mock.mockito has been deprecated and marked for removal
[WARNING] /C:/Users/elian/OneDrive/Documentos/1-Proyectos/Reales/sistema-riego-goteo-api/src/test/java/com/sistemariegoagoteo/sistema_riego_goteo_api/controller/auth/AuthControllerTest.java:[49,10] org.springframework.boot.test.mock.mockito.MockBean in org.springframework.boot.test.mock.mockito has been deprecated and marked for removal
[WARNING] /C:/Users/elian/OneDrive/Documentos/1-Proyectos/Reales/sistema-riego-goteo-api/src/test/java/com/sistemariegoagoteo/sistema_riego_goteo_api/controller/auth/AuthControllerTest.java:[52,10] org.springframework.boot.test.mock.mockito.MockBean in org.springframework.boot.test.mock.mockito has been deprecated and marked for removal
[WARNING] /C:/Users/elian/OneDrive/Documentos/1-Proyectos/Reales/sistema-riego-goteo-api/src/test/java/com/sistemariegoagoteo/sistema_riego_goteo_api/controller/auth/AuthControllerTest.java:[52,10] org.springframework.boot.test.mock.mockito.MockBean in org.springframework.boot.test.mock.mockito has been deprecated and marked for removal
[WARNING] /C:/Users/elian/OneDrive/Documentos/1-Proyectos/Reales/sistema-riego-goteo-api/src/test/java/com/sistemariegoagoteo/sistema_riego_goteo_api/controller/auth/AuthControllerTest.java:[52,10] org.springframework.boot.test.mock.mockito.MockBean in org.springframework.boot.test.mock.mockito has been deprecated and marked for removal
[WARNING] /C:/Users/elian/OneDrive/Documentos/1-Proyectos/Reales/sistema-riego-goteo-api/src/test/java/com/sistemariegoagoteo/sistema_riego_goteo_api/controller/auth/AuthControllerTest.java:[52,10] org.springframework.boot.test.mock.mockito.MockBean in org.springframework.boot.test.mock.mockito has been deprecated and marked for removal
[WARNING] /C:/Users/elian/OneDrive/Documentos/1-Proyectos/Reales/sistema-riego-goteo-api/src/test/java/com/sistemariegoagoteo/sistema_riego_goteo_api/controller/auth/AuthControllerTest.java:[52,10] org.springframework.boot.test.mock.mockito.MockBean in org.springframework.boot.test.mock.mockito has been deprecated and marked for removal
[WARNING] /C:/Users/elian/OneDrive/Documentos/1-Proyectos/Reales/sistema-riego-goteo-api/src/test/java/com/sistemariegoagoteo/sistema_riego_goteo_api/controller/auth/AuthControllerTest.java:[55,10] org.springframework.boot.test.mock.mockito.MockBean in org.springframework.boot.test.mock.mockito has been deprecated and marked for removal
[WARNING] /C:/Users/elian/OneDrive/Documentos/1-Proyectos/Reales/sistema-riego-goteo-api/src/test/java/com/sistemariegoagoteo/sistema_riego_goteo_api/controller/auth/AuthControllerTest.java:[55,10] org.springframework.boot.test.mock.mockito.MockBean in org.springframework.boot.test.mock.mockito has been deprecated and marked for removal
[WARNING] /C:/Users/elian/OneDrive/Documentos/1-Proyectos/Reales/sistema-riego-goteo-api/src/test/java/com/sistemariegoagoteo/sistema_riego_goteo_api/controller/auth/AuthControllerTest.java:[55,10] org.springframework.boot.test.mock.mockito.MockBean in org.springframework.boot.test.mock.mockito has been deprecated and marked for removal
[WARNING] /C:/Users/elian/OneDrive/Documentos/1-Proyectos/Reales/sistema-riego-goteo-api/src/test/java/com/sistemariegoagoteo/sistema_riego_goteo_api/controller/auth/AuthControllerTest.java:[55,10] org.springframework.boot.test.mock.mockito.MockBean in org.springframework.boot.test.mock.mockito has been deprecated and marked for removal
[WARNING] /C:/Users/elian/OneDrive/Documentos/1-Proyectos/Reales/sistema-riego-goteo-api/src/test/java/com/sistemariegoagoteo/sistema_riego_goteo_api/controller/auth/AuthControllerTest.java:[55,10] org.springframework.boot.test.mock.mockito.MockBean in org.springframework.boot.test.mock.mockito has been deprecated and marked for removal
[WARNING] /C:/Users/elian/OneDrive/Documentos/1-Proyectos/Reales/sistema-riego-goteo-api/src/test/java/com/sistemariegoagoteo/sistema_riego_goteo_api/controller/riego/FarmControllerTest.java:[47,6] org.springframework.boot.test.mock.mockito.MockBean in org.springframework.boot.test.mock.mockito has been deprecated and marked for removal
[WARNING] /C:/Users/elian/OneDrive/Documentos/1-Proyectos/Reales/sistema-riego-goteo-api/src/test/java/com/sistemariegoagoteo/sistema_riego_goteo_api/controller/riego/FarmControllerTest.java:[47,6] org.springframework.boot.test.mock.mockito.MockBean in org.springframework.boot.test.mock.mockito has been deprecated and marked for removal
[WARNING] /C:/Users/elian/OneDrive/Documentos/1-Proyectos/Reales/sistema-riego-goteo-api/src/test/java/com/sistemariegoagoteo/sistema_riego_goteo_api/controller/riego/FarmControllerTest.java:[47,6] org.springframework.boot.test.mock.mockito.MockBean in org.springframework.boot.test.mock.mockito has been deprecated and marked for removal
[WARNING] /C:/Users/elian/OneDrive/Documentos/1-Proyectos/Reales/sistema-riego-goteo-api/src/test/java/com/sistemariegoagoteo/sistema_riego_goteo_api/controller/riego/FarmControllerTest.java:[47,6] org.springframework.boot.test.mock.mockito.MockBean in org.springframework.boot.test.mock.mockito has been deprecated and marked for removal
[WARNING] /C:/Users/elian/OneDrive/Documentos/1-Proyectos/Reales/sistema-riego-goteo-api/src/test/java/com/sistemariegoagoteo/sistema_riego_goteo_api/controller/riego/FarmControllerTest.java:[47,6] org.springframework.boot.test.mock.mockito.MockBean in org.springframework.boot.test.mock.mockito has been deprecated and marked for removal
[WARNING] /C:/Users/elian/OneDrive/Documentos/1-Proyectos/Reales/sistema-riego-goteo-api/src/test/java/com/sistemariegoagoteo/sistema_riego_goteo_api/controller/riego/FarmControllerTest.java:[50,6] org.springframework.boot.test.mock.mockito.MockBean in org.springframework.boot.test.mock.mockito has been deprecated and marked for removal
[WARNING] /C:/Users/elian/OneDrive/Documentos/1-Proyectos/Reales/sistema-riego-goteo-api/src/test/java/com/sistemariegoagoteo/sistema_riego_goteo_api/controller/riego/FarmControllerTest.java:[50,6] org.springframework.boot.test.mock.mockito.MockBean in org.springframework.boot.test.mock.mockito has been deprecated and marked for removal
[WARNING] /C:/Users/elian/OneDrive/Documentos/1-Proyectos/Reales/sistema-riego-goteo-api/src/test/java/com/sistemariegoagoteo/sistema_riego_goteo_api/controller/riego/FarmControllerTest.java:[50,6] org.springframework.boot.test.mock.mockito.MockBean in org.springframework.boot.test.mock.mockito has been deprecated and marked for removal
[WARNING] /C:/Users/elian/OneDrive/Documentos/1-Proyectos/Reales/sistema-riego-goteo-api/src/test/java/com/sistemariegoagoteo/sistema_riego_goteo_api/controller/riego/FarmControllerTest.java:[50,6] org.springframework.boot.test.mock.mockito.MockBean in org.springframework.boot.test.mock.mockito has been deprecated and marked for removal
[WARNING] /C:/Users/elian/OneDrive/Documentos/1-Proyectos/Reales/sistema-riego-goteo-api/src/test/java/com/sistemariegoagoteo/sistema_riego_goteo_api/controller/riego/FarmControllerTest.java:[50,6] org.springframework.boot.test.mock.mockito.MockBean in org.springframework.boot.test.mock.mockito has been deprecated and marked for removal
[WARNING] /C:/Users/elian/OneDrive/Documentos/1-Proyectos/Reales/sistema-riego-goteo-api/src/test/java/com/sistemariegoagoteo/sistema_riego_goteo_api/controller/riego/FarmControllerTest.java:[53,6] org.springframework.boot.test.mock.mockito.MockBean in org.springframework.boot.test.mock.mockito has been deprecated and marked for removal
[WARNING] /C:/Users/elian/OneDrive/Documentos/1-Proyectos/Reales/sistema-riego-goteo-api/src/test/java/com/sistemariegoagoteo/sistema_riego_goteo_api/controller/riego/FarmControllerTest.java:[53,6] org.springframework.boot.test.mock.mockito.MockBean in org.springframework.boot.test.mock.mockito has been deprecated and marked for removal
[WARNING] /C:/Users/elian/OneDrive/Documentos/1-Proyectos/Reales/sistema-riego-goteo-api/src/test/java/com/sistemariegoagoteo/sistema_riego_goteo_api/controller/riego/FarmControllerTest.java:[53,6] org.springframework.boot.test.mock.mockito.MockBean in org.springframework.boot.test.mock.mockito has been deprecated and marked for removal
[WARNING] /C:/Users/elian/OneDrive/Documentos/1-Proyectos/Reales/sistema-riego-goteo-api/src/test/java/com/sistemariegoagoteo/sistema_riego_goteo_api/controller/riego/FarmControllerTest.java:[53,6] org.springframework.boot.test.mock.mockito.MockBean in org.springframework.boot.test.mock.mockito has been deprecated and marked for removal
[WARNING] /C:/Users/elian/OneDrive/Documentos/1-Proyectos/Reales/sistema-riego-goteo-api/src/test/java/com/sistemariegoagoteo/sistema_riego_goteo_api/controller/riego/FarmControllerTest.java:[53,6] org.springframework.boot.test.mock.mockito.MockBean in org.springframework.boot.test.mock.mockito has been deprecated and marked for removal
[INFO] 
[INFO] --- surefire:3.5.4:test (default-test) @ sistema-riego-goteo-api ---
[INFO] Using auto detected provider org.apache.maven.surefire.junitplatform.JUnitPlatformProvider
[INFO] 
[INFO] -------------------------------------------------------
[INFO]  T E S T S
[INFO] -------------------------------------------------------
[INFO] Running IrrigationService - Tests Unitarios
Java HotSpot(TM) 64-Bit Server VM warning: Sharing is only supported for boot loader classes because bootstrap classpath has been appended
20:24:29.004 [main] INFO com.sistemariegoagoteo.sistema_riego_goteo_api.service.riego.IrrigationService -- Usuario admin registr¾ un nuevo riego (ID: 1000) para el sector Sector Norte
20:24:29.045 [main] WARN com.sistemariegoagoteo.sistema_riego_goteo_api.service.riego.IrrigationService -- Eliminando registro de riego ID 1000
[INFO] Tests run: 7, Failures: 0, Errors: 0, Skipped: 0, Time elapsed: 2.053 s -- in IrrigationService - Tests Unitarios
[INFO] Running PrecipitationService - Tests Unitarios
20:24:29.182 [main] INFO com.sistemariegoagoteo.sistema_riego_goteo_api.service.riego.PrecipitationService -- Registrando precipitaci¾n para finca ID 1 en fecha 2026-02-22: 10.00mm total, 3.75mm efectiva
[ERROR] Tests run: 2, Failures: 0, Errors: 1, Skipped: 0, Time elapsed: 0.126 s <<< FAILURE! -- in PrecipitationService - Tests Unitarios
[ERROR] com.sistemariegoagoteo.sistema_riego_goteo_api.service.riego.PrecipitationServiceTest.getMonthlyPrecipitation_Ok -- Time elapsed: 0.109 s <<< ERROR!
org.mockito.exceptions.misusing.UnnecessaryStubbingException: 

Unnecessary stubbings detected.
Clean & maintainable test code requires zero unnecessary code.
Following stubbings are unnecessary (click to navigate to relevant line of code):
  1. -> at com.sistemariegoagoteo.sistema_riego_goteo_api.service.riego.PrecipitationServiceTest.setUp(PrecipitationServiceTest.java:58)
  2. -> at com.sistemariegoagoteo.sistema_riego_goteo_api.service.riego.PrecipitationServiceTest.setUp(PrecipitationServiceTest.java:59)
Please remove unnecessary stubbings or use 'lenient' strictness. More info: javadoc for UnnecessaryStubbingException class.
	at org.mockito.junit.jupiter.MockitoExtension.afterEach(MockitoExtension.java:197)
	at java.base/java.util.ArrayList.forEach(ArrayList.java:1511)
	at java.base/java.util.ArrayList.forEach(ArrayList.java:1511)

[INFO] 
[INFO] Results:
[INFO] 
[ERROR] Errors: 
[ERROR]   PrecipitationServiceTest.getMonthlyPrecipitation_Ok ╗ UnnecessaryStubbing 
Unnecessary stubbings detected.
Clean & maintainable test code requires zero unnecessary code.
Following stubbings are unnecessary (click to navigate to relevant line of code):
  1. -> at com.sistemariegoagoteo.sistema_riego_goteo_api.service.riego.PrecipitationServiceTest.setUp(PrecipitationServiceTest.java:58)
  2. -> at com.sistemariegoagoteo.sistema_riego_goteo_api.service.riego.PrecipitationServiceTest.setUp(PrecipitationServiceTest.java:59)
Please remove unnecessary stubbings or use 'lenient' strictness. More info: javadoc for UnnecessaryStubbingException class.
[INFO] 
[ERROR] Tests run: 9, Failures: 0, Errors: 1, Skipped: 0
[INFO] 
[INFO] ------------------------------------------------------------------------
[INFO] BUILD FAILURE
[INFO] ------------------------------------------------------------------------
[INFO] Total time:  17.028 s
[INFO] Finished at: 2026-02-22T20:24:29-03:00
[INFO] ------------------------------------------------------------------------
[ERROR] Failed to execute goal org.apache.maven.plugins:maven-surefire-plugin:3.5.4:test (default-test) on project sistema-riego-goteo-api: 
[ERROR] 
[ERROR] See C:\Users\elian\OneDrive\Documentos\1-Proyectos\Reales\sistema-riego-goteo-api\target\surefire-reports for the individual test results.
[ERROR] See dump files (if any exist) [date].dump, [date]-jvmRun[N].dump and [date].dumpstream.
[ERROR] -> [Help 1]
[ERROR] 
[ERROR] To see the full stack trace of the errors, re-run Maven with the -e switch.
[ERROR] Re-run Maven using the -X switch to enable full debug logging.
[ERROR] 
[ERROR] For more information about the errors and possible solutions, please read the following articles:
[ERROR] [Help 1] http://cwiki.apache.org/confluence/display/MAVEN/MojoFailureException
